{
  "metadata": {
    "name": "Assert value reference",
    "description": "Assert value reference",
    "assert": {
      "header": "REGEX",
      "ignore": [
        "$._links"
      ]
    },
    "properties": {
      "obj": {
        "flag": false,
        "amt": [
          16,
          32,
          64,
          128
        ],
        "sub": {
          "desc": "```urlEncode('説明文ディスクリプション')```"
        }
      }
    }
  },
  "setup": {
  },
  "request": {
    "url": "/api/core-test",
    "method": "POST",
    "body": {
      "flag": {
        "$ref": "#/obj/flag"
      },
      "amt": {
        "$ref": "#/obj/amt/3"
      },
      "desc": {
        "$ref": "#/obj/sub/desc"
      }
    }
  },
  "response": {
    "status": 201,
    "headers": {
      "Content-Type": {
        "$ref": "integration/constant.json/#/contentType/applicationJson"
      }
    },
    "body": {
      "flag": {
        "$ref": "#/obj/flag"
      },
      "amt": {
        "$ref": "#/obj/amt/3"
      },
      "desc": {
        "$ref": "#/obj/sub/desc"
      }
    }
  },
  "cleanup": {
    "database": [
      {
        "$ref": "integration/variables/objective.json/#/query2"
      }
    ]
  }
}