{
  "metadata": {
    "name": "Assert ignore",
    "description": "Assert ignore",
    "assert": {
      "ignore": [
        "$._links"
      ]
    }
  },
  "setup": {
    "database": [
      {
        "$ref": "integration/variables/objective.json/#/query1"
      }
    ]
  },
  "request": {
    "url": "/api/core-test/1",
    "method": "GET"
  },
  "response": {
    "status": 200,
    "body": {
      "flag": true,
      "amt": 100,
      "desc": "foo"
    }
  },
  "cleanup": {
    "database": [
      {
        "$ref": "integration/variables/objective.json/#/query2"
      }
    ]
  }
}